{
  "$schema": "../../.claude-plugin/plugin-schema.json",
  "name": "design_ppt",
  "display": "PPT·디자인·다이어그램 자동화 — Gamma·Canva·Figma·Mermaid",
  "prefix": "design_",
  "version": "1.0",
  "status": "stable",
  "phase": 0,
  "commands": "commands/",
  "skills": "skills/",
  "agents": "agents/",
  "hooks": "hooks/",
  "dependencies": {
    "plugins": [
      "exec_orch"
    ],
    "mcp": [],
    "env": []
  },
  "entry_points": {
    "default_command": "make-ppt",
    "core_skills": [
      "skill-08-design",
      "skill-14-auto-detail",
      "skill-15-theme-factory"
    ]
  },
  "metadata": {
    "category": "디자인/PPT",
    "tags": [
      "design"
    ],
    "author": "bernakilljos",
    "created": "2026-04-10",
    "updated": "2026-04-19",
    "precedence": 10,
    "token_estimate": 4000,
    "triggers": [
      "PPT",
      "슬라이드",
      "프레젠테이션",
      "Gamma"
    ]
  }
}
