{
  "$schema": "../../.claude-plugin/plugin-schema.json",
  "name": "mcp_data",
  "display": "데이터 MCP 설치 — MySQL·PostgreSQL·MongoDB·BigQuery·Snowflake·Sheets·Airtable",
  "prefix": "mcp_",
  "version": "1.0",
  "status": "stable",
  "phase": 0,
  "commands": "commands/",
  "skills": "skills/",
  "agents": "agents/",
  "hooks": "hooks/",
  "dependencies": {
    "plugins": [
      "exec_orch"
    ],
    "mcp": [],
    "env": []
  },
  "entry_points": {
    "default_command": "install",
    "core_skills": [
      "skill-32-db-migration"
    ]
  },
  "metadata": {
    "category": "MCP/데이터",
    "tags": [
      "mcp"
    ],
    "author": "bernakilljos",
    "created": "2026-04-10",
    "updated": "2026-04-19",
    "precedence": 10,
    "token_estimate": 1100
  }
}
