{
  "$schema": "../../.claude-plugin/plugin-schema.json",
  "name": "ai_rag",
  "display": "RAG 파이프라인 — 8가지 패턴 (Naive/Multimodal/HyDE/Corrective/Graph/Hybrid/Adaptive/Agentic)",
  "prefix": "ai_",
  "version": "0.1",
  "status": "spec-only",
  "phase": 2,
  "commands": "commands/",
  "skills": "skills/",
  "dependencies": {
    "plugins": ["exec_orch", "mcp_data"],
    "mcp": ["llamaindex", "chromadb", "qdrant"],
    "env": ["ANTHROPIC_API_KEY", "OPENAI_API_KEY"]
  },
  "entry_points": {
    "default_command": "rag-naive",
    "core_skills": ["skill-rag-patterns", "skill-vector-db"]
  },
  "metadata": {
    "category": "AI/RAG",
    "tags": ["ai", "rag", "vector"],
    "author": "bernakilljos",
    "created": "2026-04-19",
    "updated": "2026-04-19",
    "precedence": 5,
    "token_estimate": 3600
  }
}
