{
  "$schema": "../../.claude-plugin/plugin-schema.json",
  "name": "design_video",
  "display": "영상·이미지·오디오 복원 + 편집 + 실시간 스트리밍",
  "prefix": "design_",
  "version": "2.0",
  "status": "stable",
  "phase": 0,
  "commands": "commands/",
  "skills": "skills/",
  "dependencies": {
    "plugins": [
      "exec_orch",
      "mcp_media"
    ],
    "mcp": [],
    "env": []
  },
  "entry_points": {
    "default_command": "video-restore",
    "core_skills": [
      "skill-video-remotion",
      "skill-video-retention",
      "skill-media-restore"
    ]
  },
  "metadata": {
    "category": "디자인/Media",
    "tags": [
      "design",
      "video",
      "image",
      "audio",
      "restoration",
      "streaming",
      "realtime"
    ],
    "author": "bernakilljos",
    "created": "2026-04-19",
    "updated": "2026-05-19",
    "precedence": 10,
    "token_estimate": 3000,
    "triggers": [
      "영상 편집",
      "영상 복원",
      "이미지 복원",
      "오디오 복원",
      "초해상도",
      "자막",
      "쇼츠",
      "유튜브 썸네일",
      "고화질",
      "저화질",
      "업스케일",
      "프레임 보간",
      "노이즈 제거",
      "스트리밍",
      "실시간"
    ]
  }
}
