{
  "$schema": "../../.claude-plugin/plugin-schema.json",
  "name": "ai_arch",
  "display": "AI 모델 아키텍처 라우팅 — 8가지 (LCM/VLM/SLM/MoE/MLM/LAM/SAM/LLM)",
  "prefix": "ai_",
  "version": "0.1",
  "status": "spec-only",
  "phase": 3,
  "commands": "commands/",
  "skills": "skills/",
  "dependencies": {
    "plugins": ["exec_orch"],
    "mcp": [],
    "env": []
  },
  "entry_points": {
    "default_command": "arch-suggest",
    "core_skills": ["skill-arch-selector"]
  },
  "metadata": {
    "category": "AI/Architecture",
    "tags": ["ai", "architecture", "routing"],
    "author": "bernakilljos",
    "created": "2026-04-19",
    "updated": "2026-04-19",
    "precedence": 7,
    "token_estimate": 1400
  }
}
